{"$schema":"https://json-schema.org/draft/2020-12/schema","$id":"lobster-runtime/v2","type":"object","additionalProperties":false,"required":["schema","status","target","runner","runner_version","browser_version","run_id","started_at","finished_at","project_revision","scenario_hash","project_fingerprint","dependency_fingerprint","scenarios","browser_engine"],"properties":{"schema":{"const":"lobster-runtime/v2"},"status":{"enum":["PASS","FAIL","UNAVAILABLE"]},"target":{"type":"string"},"runner":{"type":"string"},"runner_version":{"type":"string"},"browser_version":{"type":"string"},"run_id":{"type":"string"},"started_at":{"type":"string"},"finished_at":{"type":"string"},"project_revision":{"type":"string"},"scenario_hash":{"type":"string"},"project_fingerprint":{"type":"string"},"dependency_fingerprint":{"type":"string"},"scenarios":{"type":"array"},"browser_engine":{"type":"string"},"runtime_errors":{"type":"array"},"network_errors":{"type":"array"}}}
